{"kind":"FlowModelCurrent","layer":"Current","explorationArtifactRef":"artifact:flow_model_001_exploration","sourceJourneyRef":"artifact:user_journey_001_current#journey_map","selectedJourneyOptionId":"guided_issue_resolution_journey","flowSet":{"flowSetId":"support_issue_flow_set","primaryFlowId":"guided_support_primary","scope":{"actor":"客户门户用户","scenario":"提交并追踪支持问题","trigger":"客户发现账单/账号问题","outcome":"被解决、升级或带可见状态重开"},"lanes":[{"laneId":"user","title":"用户"},{"laneId":"product_system","title":"产品系统"},{"laneId":"human_or_agent","title":"人工或 Agent 支持"}],"flows":[{"flowId":"guided_support_primary","kind":"primary","title":"引导式支持主流程","sourceJourneyRefs":[{"journeyRef":"artifact:user_journey_001_current#journey_map","branchRef":"happy_path"}],"nodes":[{"nodeId":"issue_detected","laneId":"user","type":"start","title":"发现问题"},{"nodeId":"classify_issue_intent","laneId":"product_system","type":"decision","title":"识别问题意图"},{"nodeId":"submit_issue","laneId":"user","type":"action","title":"带证据提交问题"},{"nodeId":"triage_case","laneId":"human_or_agent","type":"handoff","title":"分诊工单"},{"nodeId":"surface_status","laneId":"product_system","type":"wait","title":"展示当前状态"},{"nodeId":"confirm_resolution","laneId":"user","type":"decision","title":"确认解决"}],"edges":[{"from":"issue_detected","to":"classify_issue_intent","event":"帮助入口已打开"},{"from":"classify_issue_intent","to":"submit_issue","guard":"证据已就绪"},{"from":"submit_issue","to":"triage_case","event":"问题已提交"},{"from":"triage_case","to":"surface_status","event":"工单已分诊"},{"from":"surface_status","to":"confirm_resolution","event":"解决方案已发布"}]},{"flowId":"missing_evidence_branch","kind":"branch","branchType":"edge_case","parentFlowId":"guided_support_primary","title":"证据缺失分支","sourceJourneyRefs":[{"journeyRef":"artifact:user_journey_001_current#journey_map","branchRef":"missing_evidence"}],"nodes":[{"nodeId":"classify_issue_intent","laneId":"product_system","type":"decision","title":"识别问题意图"},{"nodeId":"request_evidence","laneId":"product_system","type":"recovery","title":"请求缺失证据"},{"nodeId":"submit_issue","laneId":"user","type":"action","title":"带证据提交问题"}],"edges":[{"from":"classify_issue_intent","to":"request_evidence","guard":"缺少必要证据"},{"from":"request_evidence","to":"submit_issue","event":"证据已补充"}]}]},"decisionTrace":{"selectedOptionId":"evidence_first_flow_set","branchDecisions":[{"branchId":"missing_evidence","treatment":"separate_flow"}],"reviewer":"acas_operator","reviewedAt":"2026-05-16T12:45:00Z","rationale":"选择该方案是因为它保持主流程可读，同时保留重要恢复行为。"},"openRisks":["SLA 展示仍需策略审查。"],"evidenceRefs":["artifact:flow_model_001_exploration","artifact:user_journey_001_current#journey_map"]}
